{
  "schema_version": "foigent.litellm.spend-log.v1",
  "request_id": "litellm_req_cache_hit_001",
  "status": "succeeded",
  "start_time": "2026-07-28T01:04:06.000002Z",
  "end_time": "2026-07-28T01:04:06.125002Z",
  "model": "gpt-4o-mini",
  "model_group": "general",
  "provider": "openai",
  "prompt_tokens": "9",
  "completion_tokens": "3",
  "total_tokens": "12",
  "reported_spend": "0.0000012",
  "currency": "USD",
  "cache_status": "hit"
}
